,recordid,content,attitude
1,221591,本来气候问题就是忽悠发展中国家去工业化的(╯3╰),2
2,221595,你们不觉得空气质量越来越差了吗……？,1
3,221603,这个法国总统就是垃圾。试目以待。现在看起来支持的人最多。但他走的路可并不是光明的。,4
4,221605,不懂弹幕为啥嘲讽马克龙，要是勒庞那个极右上台，你以为黄种人对他们来说跟穆斯林有区别么，法国的亚裔不会遭殃吗,4
5,221606,(-_-#)美国人的确需要环保了，人均资源消耗量是中国的数倍,3
6,221610,热评的小学生言论还这么多赞，人家一家人讨论个东西各有自己的看法，就想着人家闹乱子了？西方的大政策永远都是美国说了算的，你要是在军事外交大方向上不和美国保持一致还想上台当总统？,4
7,221614,气候问题我还是有一点涉猎，文献资料也看过不少。不过真的说不清碳排放究竟有多大影响，至少没有直接的量化研究。而且这里面政治因素太多。,2
8,221629,最好的结局：美法相争，中国得利,4
9,221638,现在“环保”已经是涉及一种新的自然崇拜与唯科学的思想了，其政治与经济利益的驱动早就超越了环境保护人类持续的定义，代替以，为了地球维持某种环境而必须反对人类权利的信条。,1
10,221646,中国的一些人成天嘲笑什么法兰西斯坦，好像懂得很多。如果法国右翼新纳粹上台，拿着核武、航母和世界前列的军事和经济搞事，到时你们就明白温和派的好处了。,4
11,221747,说太阳黑子运动导致气温变化，全球变暖导致冰川融化海平面上升我还算有点信，说碳排放导致温室效应我是不信的。全世界几百个国家正真实现工业化的其实并不多，而且地球只有十分之三是陆地，大部分是海洋，这点排量就想给整个地球形成温室？希望你们这些气候研究员多研究研究洋流气流运动、臭氧层空洞等等，不要整天吹嘘二氧化碳排放,2
12,221749,疯狂发展破坏了生态照样活不下去，大忽悠以为谁都愿意被他忽悠啊눈_눈,2
13,221751,巴黎气候大会，中国让步很多。本该发达国家承担的义务，中国也承担了不少。才换来了美国碳减排。如果美国退出的话。中国碳减排承诺还要做吗？是不是中国的让步就白费了？所以这点我支持马克龙。,3
14,221781,选了马克龙是政治正确，但也表示衰落还在继续;干嘛不选阿姨呢，拼一把，改革一下，说不定法国就是世界第一强国了。,4
15,221784,我们也不玩儿，我们承诺减排其实是有顺水推舟的意思，全球变暖是事实，但是被夸大也是事实，被人利用更是事实。特朗普要振兴制造业，要回迁很多产业，必然会增加碳排放。作为世界老大，怎么会让别人薅自己的羊毛,2
16,221799,法国人的英语是真的。。无语,4
17,221815,对内的医保法案之类的也就罢了  在国际上签署的协议也能说费就费？  这已经不只是任性的问题了吧,3
18,407442,这种人是不受欢迎的人类，禁止它过境中国。,2
19,407446,干预全球变暖的本事没有，借着全球变暖敛财的本事还是有的，而且很大,2
20,407449,人类活动就是气候变化的主要原因，但这个原因全都是发达国家的锅,2
21,407452,所以，她到底如何看待日本向海洋排放核污水的呢？,4
22,407457,气候变暖是真实而又“不可逆的，过去几万亿年里气候确实存在高低温度的波动，但是在1500（大概第一次工业革命后）到现在的这500年气候上升的速度增加了非常非常多。。。也就是说我们要几百年时间经历过去几百万年才能达到的高温气候，这种高温会导致大量动植物灭绝，因为几百万年的变温动物还能靠突变适应，几百年那只能靠人为保护了,1
23,407459,人类活动无疑是导致气候变暖的一个重要因素，但是从地质学尺度上讲，现在的地球其实正处于两个冰期间的间冰期，远没有到平均温度远没达到历史高位，甚至中高位都没有。只是这种气候变化对我们人类生存影响确实很大，保护地球是个伪命题，其实只是保护我们人类自己罢了。,1
24,407460,其实你换一个角度看，西方那些政客好事占尽，坏事干尽，永贝里在那个大环境下，她说的话有其正确性,1
25,407462,我看好西方式的自私环保，或者其他什么的全球治理一事无成,2
26,407465,扔非洲最落后的国家，什么都不给活过一年再回来说这些！,3
27,407468,刚刚出名的时候，还有很多活动邀请那啥环保少女，可是很快，真干活的就发现这货就一个嘴炮啊，没人搭理了，不骂她就是给面子……我们环保，来自我们的传统文化，道法自然，尊重生命，跟国外那些被污染教育过的野蛮人不是一回事，也不用理会那些疯子逗傻子的游戏。,3
28,407469,不懂装懂！,2
29,407475,“环保”少女vs“环保”领导人,2
30,274574,动物园的动物此刻还是很幸运了，虽不自由，可叹无数的动物都被无情的大火所伤害而丧失家园或是被夺去生命，为澳洲消防战士们加油，为所有遭受到不幸的人，动物们祈祷平安！,1
31,274579,坐标浙江台州 今天下午出门看个牙 看太阳挺大就穿了件薄长袖加薄外套就出门了 外面不仅太阳大风也大 骑着电瓶吹这南方一月份的风极为惬意 看着一名路过的短袖大哥我甚至想去喝个冰阔落,3
32,274585,今年地球冷暖达到了90摄氏度，让人害怕。记得十几年前冬天还有大雪，还能穿得住长羽绒服，现在一冬天能勉强凑一场雪就不错了，最冷的时候一件短羽绒服一件不需要太厚的毛衣就过冬了。,1
33,274594,坐标厦门 2019年估计是全年无冬了 最低也就下雨那两天8度 但最高温也有17 18度 每天就穿一件长袖校服就够了 秋裤什么的都不存在的,1
34,274599,大冬天的，你给我发这个？！,4
35,274620,其实澳大利亚不仅仅是热，而是因为大火，没错，就是四个月前的那场，现在还没灭。澳总理已经跑到国外度假了,3
36,274624,山林大火能不热吗？希望早日灭火保护自然和民众消防员安全,1
37,274645,南方果然更暖，屁啊(来自一个裹在被窝的蓝帆人),3
38,274652,广东广州今天短袖，你们信不？,3
39,274655,气候问题是个大事,1
40,274742,我感觉今年是有史以来最不冷的冬天，小时候那种穿五六件衣服都冷到入心入肺颤抖不已。现在，呵呵，短t加衬衫，要是再冷就加个卫衣。。。来广东的小伙伴,1
41,221531,特朗普：反正我最多再有三十年就要死了，关我毛事，我不相信。→_→,4
42,221544,法国大选结果终于揭晓，倡导跨越左右阵营、认同西方主流价值观、年仅39岁的独立候选人马克龙入住爱丽舍宫。这是2017年继荷兰大选之后，欧洲本土对极右政治势力的又一次胜利。这位法国史上最年轻的民选总统，将给欧洲乃至世界带来什么改变？不同尽管从民调显示数据看，勒庞当选的希望渺茫，但特朗普的当选，本就告诉我们千万别轻信民调。如若代表极右翼实力的勒庞当选，那么对于法国、欧盟及世界都将带来颠覆性的改变。世人或许难以理解的是，为何欧洲的经济危机、难民危机、恐怖袭击、种族问题都远比英国、美国严重，但为什么英国人民、美国人民都做出了“民粹主义”的选择，但欧洲本土却并未如此？这要先从国民性讲起。英、美都属于盎格鲁.撒克逊民族，这个民族历史上来看就以务实、追求实利著称。价值观不过是维护国家利益的手段。所以，当出现发展的机会、或者危机发生时，哪怕还没有达到危险的境地，都能够迅速作出反应。欧洲本土则相反，过于偏重价值观而疏于现实危机的解决，甚至宁可牺牲经济利益而维持价值观。比如当中国主导的亚投行横空出世，虽然和中国经贸利益最为巨大的是德国，政治上有特殊关系的是法国，但却只有在英国孤身一人作出表率之后，其他欧洲国家才敢于跟进。要知道当时，英国面临等最重要的压力，首先就是盟友美国的反对。再比如，英、美一向只接受高素质的移民，对其他类型的外国人进入都设置了很高的门槛。甚至，难民问题就成为英国脱欧的部分原因，按照欧盟内部人员、资本自由流动的原则，英国必须要接受一定配额难民，这个难民危机对于希望英国退欧的人，确实坚定了他们的决心。这和欧洲本土出于人道而敞开大门的做法非常不同。其次，英美国家认同自由竞争，国家的福利相对于欧洲来讲还是低水平的，也不完善。所以危机一旦发生，民众的感受往往十分的直接和强烈。但欧洲本土的福利既完善标准也高，从而减缓了危机到来时民众的痛苦。但也自然减轻了民众对问题存在的敏锐度和反应能力。而这些都自然而然的体现在选举中。所以，从上面两个角度就可以理解，为何欧洲的极右翼问题远比英美严重，但却没有作出和英美一样的反应。,4
43,221554,法兰西斯坦欢迎你.,4
44,221555,有些评论真是酸得辣眼睛_(:3 」∠)_ 如果你是科学家、研究员 你们国家的领导放弃科研、切断了你的研究经费 基本上你就等于失业了 你是选择留在祖国刷盘子还是跳槽去其他国家更有前途和远见的机构继续做研究？？,4
45,221557,上个世纪西方世界工业化破坏环境没人管，现在你们转向虚拟经济就喷发展中国家以中国为首破坏环境，说白了没人真的在乎环境，还不是要遏制第三世界崛起阻止工业化进程然后纳入西方理论规则制定虚拟经济中和日韩新加坡一样当傀儡,2
46,407423,今年诺贝尔物理学奖三位获奖人的成果应该算是一锤定音，从科学上验证了人类活动对气候的影响。今年的气候变化大会政治意味如此之重，一定程度上也是受到科学界共识的催促。我们倡导人类命运共同体，本质就是在对国际的分歧秩序做尝试性的整合。我们反对的不是环保，而是发达国家推卸责任的行为。世界应该认真坐下来探讨一条可行的解决措施，而不是相互攻伐。我们做出承诺，也是在树立榜样。我们揭穿发达强权的嘴脸，并带头思考如何让发展和环保并存。可以说在西方的道德大棒面前，我们的抗争是所有发展中国家的希望。,1
47,407425,气候问题或者人类未来问题唯一解，杀掉所有昂撒人，一个不留,3
48,407429,How dare you.,2
49,407430,同样是辍学，人家的英语起码学的还不错，还是比一般的学渣强,4
50,407435,成啊，环保是吧。干脆叫她裸体去森林玩儿吧,2
51,407436,说一个发生在气候峰会上的趣事。在联合国气候峰会举办的国际记者会上，正在用中文回答记者问题的中国气候特使解振华，突然被美联社的记者打断。“打断一下，你能不能直接用英文回答问题？”乖乖，好大的口气啊，在场的人也是一愣。我们解大使的回答也是很机智：“不如你用中文提问喽”在美国人看来，整个世界都是由我们昂撒国家主导的，当然要用英格利诗回答问题了，赢麻了属于是,3
52,407439,让她去感化美利坚人民吧！,2
53,407345,去年还能说“How dare you！”今年就是会“blah！blah！blah！”明年指不定“WuWuYiEiWu”《关于环保运动会导致逆生物进化理论的研究》今天立冬，成都的天气直接把我冷醒了！“全球变暖！？”“暖个P！”,2
54,407347,太精彩了，这演讲我哭了，笑哭的,2
55,407354,欧式环保，只打嘴炮,2
56,407361,比较好奇的是，瑞典的这位活宝这次去英国，是自己划船去的，还是坐飞机去的？,2
57,407367,我朋友的导师和师爷都去做讲座，希望老先生没被环保公主吵到真的是，爱在瑞典嚷嚷就在瑞典嚷嚷，不要打扰别人干工作好吧,3
58,407370,格雷塔可真是个小机灵鬼去英国翘个课，回国（她要还在读书）差不多就该höstlov（放学生假）了,2
59,407384,通小胖墩又不等于环保事业，它屁事没干还翘课，整天口嗨嘴炮引着群西方大傻子玩，其实吧，它就是台前的木偶，为别人攫取利益的脏手套，不然为啥本子排核污水不见它放一屁？睡王八十五车拜教皇也没见它吱一声！只是因为小胖墩和后面的利益人知道自己的主子是谁。,2
60,407397,我觉得全球变暖就是人类活动导致的。但是这不代表一些政治家可以站在在道德制高点谴责，因为全球变暖是一个趋势，人类的经济活动是停不下来的，经济必须一直维持上升的状态，否则穷人根本吃不上饭。解决全球变暖，这是一个科技问题。其实这是要由科学家出面的解决，明明是一个技术问题，却被一些政治家或者所谓的环保组织渲染成一种政治工具，为自己的选票和利益。而且我觉得全球变暖不是一个阴谋论，而这政客和环保卫士的嘴脸才是阴谋。,1
61,407412,白人的环保，只是政治需要。,2
62,407414,高端的逃课方式 我们小时候装病这种跟这一比 太幼稚啦,2
63,407419,害，真“环保”的胆子没有，但借着“环保”的名义敛财的胆子是有的，而且很大！,3
64,153666,和庆怜一起保护地球，尊重大自然，从你我做起,1
65,153674,大家一起传递正能量！关注气候变暖！看了冰冻星球真的很有感触,1
66,153677,跟着庆怜一起保护环境,1
67,153686,发错地方了吧？我们中国人搞环保轮得到你们昂撒人来教？玩笑别开太大,3
68,153687,和庆怜一起保护环境，关注气候变化，守护地球！,1
69,407333,除了耗跌油，感觉她就没梗了。感觉她江郎才尽了,2
70,407337,她长得越来越像马斯克了,4
71,153063,这个评论区都是同一句话，不看视频还以为是鞋教现场呢,4
72,153066,啊啊啊大庆一起保护环境呀！看了评论区想说，无论来自哪个国家，无论资本是否裹挟左右着我们的目光，呼吁一同保护环境关注气候变化，是我们作为普通人能发出的微弱光芒，有声音才会有关注，思考，行动，萤火之光汇聚，才能真正推动一个群体去做出改变,1
73,153072,很好奇刷这么多整齐的弹幕，还能上首页，一共花了多少呀，哪家能接这种想了解下。,4
74,153132,你们国家有什么资格在环境保护方面宣传啊，你们做过什么？就一堆极左在那用嘴说，也没见你们有什么实际行动啊。,3
75,153135,这种流量的粉丝一般比较幼稚无脑，容易欺骗。严防欧美国家从这种粉丝入手，进行洗脑，宣传西方错误价值观，进而扩大化为颜色革命！,4
76,153144,所以日本偷排核废水这事你们怎么看？,4
77,153148,全球变暖，极端天气越发频繁，保护环境就是保护自己，保护自己的家园。这不是说教，这是呼吁，在大自然面前人类是命运共同体，不要用您短浅的目光来表明自己是个垃圾。,1
78,153152,对地球而言，我们就是蝼蚁。祂不需要我们保护。倒不如改成保护我们自己的生存环境，没了生物地球照样转,1
79,153192,我不明白怎么有那么多心理阴暗的人，庆怜又怎么了，不喜欢可以不看，不要来嘴他，每个人都应该被尊重。总是这样嘴别人，就不怕会反弹到自己么！,4
80,153198,同问，英国啥时候把人均碳排放减一下？不要只喊口号，只打广告,3
81,153199,我笑了，英国人什么时候少吃点？？搁这呼吁中国人保护环境？？还是快去你的老家呼吁一下吧！,3
82,153200,自己掠夺世界完成了工业化，现在对别的工业化中的gj指指点点，e不ex啊,2
83,153205,澳洲大火时，澳洲政府极其不负责的态度，和近乎于零的拯救措施。让地球遭受了磨难。今年的天气异常，是否受其影响？英国大使是否可以公开批评澳大利亚这种放任的态度呢？顺便再拯救下澳大利亚的大堡礁。 大堡礁是世界人民的资源。不仅仅是澳大利亚的。,1
84,153207,非洲一大部分国家连工业化都没够上呢，这边开始谈论气候变化，真是不给非西方国家活路啊。英国还是老大哥，狠呐。,2
85,153223,我是学环境的，研究的是水银污染，环境是门大生意，咱们这些老老实实做环境保全的比不过外国面孔一句话，合着每天不是吃就是玩儿。咱们国家的环境专家不比国外少，别被人卖了还帮着数钱。,2
86,153224,平常连垃圾都不会分类，还可能随手乱扔的人在评论区跟我讲环保?讲格局? 你怎么不去死啊?!,3
87,153226,如果说以前我们是生活在自然里面 然而现在我们人口太多了  只有圈养自然这一条路走啊.要不然保护自然就是和穷人作对..因为穷人只剩下自然资源了.而且环保部门一贯的做法 不管那个国家的.只会解决制造问题的人..因为这往往是嘴简单的办法（比如麦秆粉尘.一个省级别的组织还真的搞不到能除尘的收割机？嘴皮动一动就好了？）~包括那些所谓的世界组织.最有意思的是 人和自然和谐相处 .城市里哪里来的自然？..所以这话现实就变成了 农村人必须和自然和谐相处.保护自然的法规 永远管到的都是和自然打交道的人 和大部分城市人无关.这是何等公平的法律啊！,3
88,153257,保护大自然，人人有责,1
89,153352,保护环境，是我们现在每个人的责任,1
90,153353,“我们的行动决定着地球气候的未来”,1
91,153613,环境保护，从我们做起,1
92,153657,一起关注气候变化，守护我们的地球?,1
93,152654,英国人少喝点牛奶，少吃些牛肉，减少碳排放。中国人人均少的可怜。别又当又立。气候变化从英国人少吃一顿牛肉开始，蟹蟹。,3
94,152720,救命他声音好听的要死,4
95,152733,环境保护真的很重要，人类每年对海洋，森林造成的污染是无法挽回的，所以我们更应该树立环保意识，我看了他倡导的网站，可以转换成为中文挺方便的，在网站中我们可以得到不同专业人士从不同的视角以讲故事的方式将环境保护通俗易懂的让人们了解，让人们知道环境保护的重要性以及方法以此抵御气候变化带来的灾难，这真的是很有意义的事情，不仅丰富自己的知识更保护环境，何乐而不为呢？,1
96,152778,之前的物料里庆怜在过生日许了两个愿望，一个是长高，一个是海洋垃圾减少，工作人员说只能许一个愿望时，崽崽选择了海洋垃圾减少四海为家的崽崽真的很有全球意识，我们和庆怜一起关注气候，保护地球,1
97,152788,不知道评论里在阴阳怪气啥？保护地球是每个人都应该做的，作为一个偶像，他本身身后有巨大的粉丝体量，各种活动通过偶像进行倡议，能带动其身后的粉丝体量，推动事情的发展。这也是在当今这个流量社会最常见的方式，为了发泄对某某对象的不满，发表一些奇奇怪怪的言论真的未免格局过小！,1
98,152810,这次河南的暴雨真的让人很难过，我和朋友已经捐助一些略表心意，在未来会和正能量艺人庆怜一起更加关注环境的变化。保护环境人人有责。,1
99,152833,从你说愿望是长高和海洋垃圾减少 别人告诉你只能实现一个 你选择了后者 我就知道我的小孩是有世界公民意识、有格局的人❤️,1
100,152867,对等彼此都要承担相应的责任和义务，发达国家更应该先于一步。减少碳排放。你们已经提前排放了几百年了。应该有所节制。,1
101,152899,听见欧洲人说环保，我都想笑,2
102,152905,爬爬爬，先把你们自家人均碳排放降下来，再来说我们！,3
103,152916,当我们抓着英国人的人均碳排放量，人家也会抓着我们高居榜首的碳排放总量，保护环境不是全人类的责任吗，这种视频不应该是无国界值得肯定的吗，这个视频宣传正能量立意是好的，没必要喷，少一个这种视频可能会少一些保护环境的人,1
104,152923,确实可能被喷，这个up的名字+环境保护+崽的大部分粉丝是中国的但是了解崽的人知道崽四海为家，他的立场是全球，希望崽不要被有心之人利用吧我相信办办的能力，也相信崽。,1
105,152930,庆怜好像一直都很关注地球的环境问题，这个问题也确实刻不容缓，希望大家都可以重视并参与进来,1
106,152940,环境污染等一系列问题是我们都应该重视的，所有人都可以从少用一个纸杯少用一个塑料袋做起，这个只是起到呼吁大家一起奋斗的作用，不应该以偏概全，所有人都有环保的意识，只是少数人的意识不强，或是只想着方便自己，但呼吁大家总是没有错的，让我们一起为保护环境做出贡献吧！加油，地球会因为我们更加漂亮的！,1
107,152941,请把圆明园还给我们！！谢谢,4
108,152980,保护环境是全球人共同的责任，在自己力所能及的范围里做到保护好环境，尽可能呼吁更多人去保护环境，无论是哪个国家都是一样的。粉丝顺着名摸过来，且评论的也都是呼吁一起保护环境，点草就精准点，不要说什么传教现场，呼吁保护环境也算是传教了吗,1
109,153031,中国这些年为了环保做了巨大的努力，牺牲了很大一部分的经济来成全。只要不是肉蛋奶式的洗脑，我们一起响应国家号召绿水青山就是金山银山。庆怜作为偶像起带头作用是很好的榜样，但是国人还是要警惕国外的NGO组织。,1
110,153033,这个题材真的很棒，关注地球环境变化，保护地球是我们每个人的责任，多点来自各方对环境保护的呼吁和引导真的太重要了！? ? ? ?,1
111,149668,对不起恐龙先生，即使是要帮助贫困人口，我们也依然需要消耗化石燃料，因为贫穷的国家或地区在工业化的过程中需要消耗化石燃料。,3
112,149669,1，这种恐龙在恐龙危机里属于各项属性都很均衡的种类，众所周知这种恐龙是最有前途的。2，为什么说英语，如果你能多掌握点外语就会知道，英语是TM最好学的。。。。。,4
113,149673,我从视频开始就想笑，看完反而有点想哭了。这么些年下来我越来越不会把人往好的地方想了，对外国也是一点信心都没了，当年人类命运共同体的理想世界现在越来越是个笑话，人类能在我有生之年内实现太空移民吗，退一步，能在我有生之年实现太空工业吗,4
114,149681,恐龙什么也没做顺其自然还是灭绝了，这难道不是在说我们应当选择一条不同于它们的路线吗？认识世界，改造世界！,2
115,149685,越看联合国越感觉。西式主导下的世界。永远都不可能消灭贫困和饥饿,4
116,149686,好话怪话虚伪话变着花样说，人事时一件都不干啊，不但不干还要打击阻挠实心干的，看到这个视频我无言以对只能发出？？？？？？？？？？？,1
117,149701,老人地铁手机,4
118,149756,全球气候变迁是自然界的规律，人类只是加快了其步伐而无法改变其结果，而且气候变迁只会做到减少人类数量不会达到灭绝，食物链的顶端不是白站的。,2
119,149757,营销宣传这一块 西方确实牛逼，但就是不干实事，面子他挣 活你干，不是吗,1
120,149759,薅爹啊you？,2
121,149762,我都无语了，前脚呼吁人类不要自我毁灭，扭脸绝壁扯到中国人吃肉蛋奶，海鲜和发展所需的碳排放上，我算看透了西方所谓环保什么德行了。其实我特别想和西方所谓环保人士玩加“砝码”游戏。我们先来：截止2020年上半年，兔子已经植树造林6646万亩，该你了西方环保主义者,1
122,149767,国家与国家之间是平等的，或者有的觉得高人一等。既然是平等，那么就谁也没法命令谁去做什么。完全靠自觉。那靠自觉的话，从个人观点出发，不投机倒把，不薅羊毛不就是亏么。一群同学在自习，也需要一个老师看管着，引导着。指望大部分同学齐心协力搞点正事，本身就是游戏里面最难的情况了。匹配了100个队友，都得是会玩的。太难了。,1
123,149776,我们来回顾一下白左环保的特征：1.口口声声要环保，但是没有任何行动；2.决口不谈环保和发展的联系；3.总是要求别人做什么。,3
124,149782,环保这东西主要看做的怎么样，其他都知道的就不说了，比如围湖造田，一说就是那个伤害水体的事情，但是濒危物种美西螈就是在特诺奇蒂特兰围田造的水上苗圃那浅水区里发展壮大的。,3
