,recordid,content,attitude
1641,390855,以温室气体排放为例。大多数学者和越来越多的政治家已经开始认识到全球变暖的现实和危险程度，但也仅止于认识，没有任何实际作为来改变我们的行事做法。对于全球变暖，我们谈得很多，但到了实际行为，人类却不愿为了制止这场灾难而真正在经济、社会或政治上做出牺牲。2000——2010年，温室气体排放量非但没有减少，反而还以每年2.2%的速度增长；而在1970——2000年，其年增长率仅为1.3%。4 1997年协议减排温室气体的《京都议定书》，目标只是减缓而非阻止全球变暖，但美国这个全球第一大污染者却拒绝签署，也全然不去尝试大幅减少温室气体排放，唯恐妨碍其经济成长。2015年12月，《巴黎协定》制定出较远大的目标，即呼吁将全球平均气温升幅限制在工业化前水平以上1.5℃以内。然而，许多为了达成这项目标所必要采取的痛苦措施却都被轻描淡写地延迟到2030年，甚至是21世纪的下半叶，其实也就是把这个烫手山芋丢给了下一代。目前的主政者表面上重视环保，收割眼前的政治利益，然而减少排放（也就会减缓增长）要付出的重大政治代价却留给未来的主政者。事关全球气候治理的《巴黎协定》已于2016年11月4日正式生效。但有太多的政客和选民认为，只要经济继续增长，科学家和工程师永远都能拯救我们免于面对生态末日。谈到气候变化的问题，“增长”的真正信徒不只是希望发生奇迹，而是认为奇迹的出现理所当然。,1
1642,390856,对于全球变暖是不是骗局得可以看看这个视频丁仲礼问柴静：中国人是不是人？（完整版）,3
1643,390857,全球有没有变暖我不知道，但是我家乡确实变暖了。但是变暖是不是二氧化碳造成的，不好说啊。,3
1644,390873,其实。。。。全球变暖的原因真的很多，但是温室气体影响确实很大，所以你说跟CO2排放有关真没错，所以并不是随大流。,1
1645,390747,我就觉得很搞笑，在中国还是清朝的时候，西方国家就已经进行了第一次工业**，那个时候是18世纪60年代，之后一直到21世纪，他们排放的二氧化碳少么？他们的工业进程发展了几百年，够久了，而中国的工业进程还有很长的路要走，西方国家这个时候又跳出来说要限制二氧化碳排放。为了地球着想，为了人类着想巴拉巴拉。那都生活在一个地球上，为什么你能排放几百年的二氧化碳，中国工业没发展多少年就要受你们限制？不发展工业中国人全都去种地？继续被西方列强骑在头上欺负？,2
1646,390756,污染确实是很严重了 大城市的空气很糟糕,1
1647,390757,为了社会的稳定有的颠覆常识科学发现和一些对现有科技有极大冲击的发明被某些力量消灭了  这一切都是为了社会的稳定,4
1648,390760,丁教授哭了,4
1649,390763,二氧化碳不是的话，那就主要是地表的臭氧了，毕竟产生臭氧的机器不少,3
1650,390764,额，我不是学环境专业的，所以不发表任何意见。,4
1651,390765,感觉挺有道理的，,2
1652,390776,我不管二氧化碳还是其他的让全球变暖，空气质量越来越差这锅背吧，全球变暖这个锅必须有东西背吧，排放有毒气体就二氧化碳放量最多所以这锅才是二氧化碳背的，提倡环保节能减排难道有错？动不动雾霾很爽么？这个问题没办法讨论，你要比温度就要看所在位置经纬度，直接片面看数据很空洞，要对比需要各经纬度地区几十年的数据结合起来对比，不然也没意义。,1
1653,390798,“陟罚臧否”出自诸葛亮的《出师表》；”茕茕孑立”出自李密的《陈情表》；“沆瀣一气”出自钱易的《南部新书》；“踽踽独行”出自张绎的《祭程伊川文》；“醍醐灌顶”出自顾况的《行路难》；“绵绵瓜瓞”出自《诗经》中的《棉》。,4
1654,390804,up主只是反驳温室效应的原因只是二氧化碳，这个观点是对的啊，为什么说他是民科。。。,3
1655,390806,是不是二氧化碳导致的不重要 。。。中国 欧盟等不怎么产油的国家当然支持巴黎协定 产油国 美国 中东对巴黎协定当然无所谓 欧盟不是傻子 肯定有原因的,4
1656,390808,我觉的是这样，人类这几百年烧了地球几百万年的燃料，地球因此变热一点我觉得完全可以理解，但是人们却把变热的原因扔给了燃烧的产物co2（￣▽￣）一个脑洞，不喜勿喷,1
1657,390810,扯淡，金星大气压是地球90倍，百分之97co2，平均温度400多，离太阳更近的水星，没有大气压，白天太阳光直射处温度高达427℃，夜晚太阳照不到时，温度降低到-173℃，你说温室效应不是co2造成的，伪科学镇恶心，营销号,1
1658,390814,兄弟，你在反抗全球的科学家跟全球所有的政府吗，说他们都在胡说八道，骗人的,1
1659,390820,首先up肯定化学没学好，中国大部分是化石能转电能，众所周知利用率才4成左右，每天都要发电，1kg煤的热值29307J/kg再看看食物中的能量，最多的是油37000J/kg。你可以问一下减肥的人不吃饭多少天瘦一斤，你再看看一天中国烧多少煤，更别提石油天然气了。能不能找个高中毕业的理科生来科普……,1
1660,390821,不懂少乱发，LAJI UP  ZHU,1
1661,390822,从来就没信过什么变暖和二氧化碳，寒武纪的时候大家都过得很滋润,2
1662,390826,全球变暖的最差结果是什么？最差结果就是我们人要死了。那我们地球没有全球变暖，我们会不会死？会的。那反正早晚都要死，你管他变暖变冷干嘛？无聊呗。,2
1663,390843,上过高中就知道二氧化碳对温室效应的作用了，反智，还一副自以为是的嘴脸，民科无疑,1
1664,390844,这就是个营销号,1
1665,390847,骗局？营销号滚OK了？,1
1666,390850,二氧化碳有保温效应，这个是已经被证明了，所以二氧化碳浓度增加是一定会导致全球变暖的，虽然不一定是主要原因，但二氧化碳确实会导致全球变暖，所以标题说是骗局是什么意思，标题党举报了,1
1667,390851,（第一段并不重要，看第二段）CO2是温室气体没有错，温度升高使得CO2溶解度降低也没有错，但是问题在于过于淡化人的影响力。人若只是像动物一样生存，那么确实用不了多少碳，但是工业的发展使得地球固化了亿万年的碳物质被排放到大气中，加上森林覆盖率的减少，所造成的影响绝对没有所说的那么少。以上这些都不重要，是的，都不重要。因为无论造成全球气温变暖的重点原因是什么，都不可否认气温确实在变暖，那么气温变暖带来的影响是什么呢？海平面上升、高气压移动、更加不稳定的气候、更频繁的洪涝和旱灾。未来，更加恶劣的环境将深刻影响我们每一个人，所以，现在只要有能够使未来向更好的方向发展的举措，我们每个人都应该支持，不是吗？,1
1668,390621,不是很懂为什么那么多媒体说几十年后海平面会升高几十厘米，然后就把珠三角大部分地区淹了？？？为什么几十厘米能淹这么多地区？？？(๑• . •๑),3
1669,390626,我也觉得二氧化碳和全球变暖没有什么直接关系,1
1670,390627,那么就是人口增多，然后增多的人口附带的碳排放比如蔬菜牲畜宠物汽车细菌等造成碳排放变的更多？,3
1671,390632,金星的温室效应就是二氧化碳含量太多了，否则处于宜居带中的金星可以发展成一颗类似地球的，适宜人类生活的星球,3
1672,390640,"二氧化碳是一种温室气体啊，具有保温作用还有说感觉变冷的，两极的冷空气变成了相对活跃的热空气,在南下过程中,这股依然是很冷的空气",3
1673,390641,知道什么是蝴蝶效应？,1
1674,390648,我家在内陆，海平面再高也没有事，到时候如果沿海地区产生难民...那些现在支持特朗普的人也许从来没有想过自己有一天可能也会是难民，或者气候问题可能会产生严重的问题。,1
1675,390649,可能存在事实错误 请仔细甄别,3
1676,390650,科普工作，还是交给专业的科学家吧！不然很容易误导观众~,3
1677,390651,都不知道争个啥，无论二氧化碳排放怎样导致气候变暖，和地球气温循环变化比起来算个屁，地球一点毛事都没有。看起来是个环保问题，本质还是个经济问题，发达国家发起碳交易协定，和北上广深的人呼吁多环保一样，都是撑死了早肥的，管你饿瘦的呢~,2
1678,390654,二氧化碳排放多少变不变暖，和我关系不大，就是冰川融化我也活不到那时候，先把雾霾解决了再说别的吧，空气质量这么差还有闲心研究二氧化碳，也不知道科研人员怎么想的,1
1679,390655,一大堆初中高中的学生? ，宣传课本上的东西被打脸的人太多了……而且初高中也就是科普水平，很多细节特殊情况都是不说的。所以各位大佬在发表言论的时候还是要看看自己是否是在用初高中知识在发言。不然别人打你脸你还要杠就很难看。,4
1680,390660,全球变暖有多个因数，二氧化碳只是其中之一，占比多少根本没法测算，但是，其他因素我们控制不了，减少排放还是能做到的，至于能起到多大作用，只有天知道了。,1
1681,390661,减少碳排放是没有问题的，但我一直想全球变暖光靠人类就能影响的吗？减少碳排放对人是有好处的，但要说为了地球什么的我觉得这点东西还影响不了地球,1
1682,390665,工业化是加速了全球变暖，而非产生了全球变暖，人类的现代化建设对全球气候的影响是必然的,1
1683,390667,地球经历过酷热，经历过冰河，所以升温几度降温几度跟喝汤一样吧。也许地球也过一年四季啊，只不过这个四季的时间跨度高得人类感受不到而已,2
1684,390670,我们都是碳基生物，用c的物质运输能量，共识的能量运输物质就是co2还有，所以的数据调查都是为了辅助研究论证的，研究是主体，你数据是主体,4
1685,390674,所以二氧化碳让气候变暖不成立咯，个人觉得气候变暖是有多个元素引起的，二氧化碳只是其中之一吧。,1
1686,390681,我觉得全球变暖很正常，因为我们在冰河时期末期啊,2
1687,390682,二氧化碳具有保温作用,3
1688,390683,全球变暖是真的，我们自己都能感觉出来，但是争论的主要是全球变暖主要原因是什么，现在来看，全球变暖是周期性变暖，人类活动可能只是起到了加速作用,1
1689,390684,天数有变乃自然之理。,2
1690,390685,我就有一个问题：为啥三千年前黄河流域属**带，有犀牛和大象,3
1691,390687,现在推动碳排放的意义确实如视频所说，更多的是为了遏制空气污染提倡环境保护，因为碳排放大的往往是重工业，意味着高污染。现在碳排放本身已经不重要了，我已经很久没听说过碳交易了，说明那群政客心里也门清。,1
1692,390688,问题在于现在没人能证明。而且人类也不敢让时间证明。,3
1693,390689,政治方面的考虑，还真的是从来没有想到过的观点……如果二氧化碳含量和全球温度真的没有非常明显的正相关性的话，我们可以换个角度思考——气温没有变但是二氧化碳浓度却疯狂上升，海水酸化遗祸无穷（海洋吸收二氧化碳的能力比我们想象中的更强，据我了解，似乎是因为洋流会把高二氧化碳浓度的海水带到深层海洋中，而深层海洋的温度其实和气温并没有非常强烈的关系（4℃），结果就是海水的整体ph值飞速下降，珊瑚礁大量死亡，甲壳类通通毙命……,1
1694,390690,水蒸气上升不就凝固成冰以降水形式落下来了吗？,3
1695,390691,书上说全球变暖是大气中二氧化碳过厚导致太阳辐射只进不出导致地球过热,1
1696,390692,我早就想说了，可是又不敢说，会被喷子的那具有“知识”的口水淹没,2
1697,390702,突然想起来一个小说，小说中的小部分科学家发现人类的工业对地球的影响根本不值一提，现在的全球变暖只是假象，真正情况是间冰期即将结束，下一个冰川期就要来临。但是从上个世纪起人类就一直认为地球一直在变暖，疯狂呼吁减排降温，他们这小部分科学家提出的地球即将变冷的理论无人赞同。最后他们只好暗中准备进行核爆，因为他们发现只有核爆产生的热量可以暂时阻止冰川期来临，但很可惜最后他们的计划被发现，所有人被捕，冰川期也来临了。,2
1698,390704,全球气候变暖是一种和自然有关的现象，是由于温室效应不断积累，导致地气系统吸收与发射的能量不平衡，能量不断在地气系统累积，从而导致温度上升，造成全球气候变暖。由于人们焚烧化石燃料，如石油，煤炭等，或砍伐森林并将其焚烧时会产生大量的二氧化碳，即温室气体，这些温室气体对来自太阳辐射的可见光具有高度透过性，而对地球发射出来的长波辐射具有高度吸收性，能强烈吸收地面辐射中的红外线，导致地球温度上升，即温室效应。全球变暖会使全球降水量重新分配、冰川和冻土消融、海平面上升等，不仅危害自然生态系统的平衡，还威胁人类的生存。,1
1699,390705,人像剪辑太多了，看的很不舒服,4
1700,390706,我来说一下，科学界还有一种说法  全球变暖的原因是太阳活动频繁  导致地球温度升高  从而使溶解在海洋里的CO2释放出来了。有人就以为CO2和地球变暖有关系。但是这只是理论。,3
1701,390709,不考虑其他因素和不谈计量致死有什么区别？现在也没有完全盖棺定论，不过要找一个方向来进行研究，这并没有错。当然，可能百年几百年后证明这条路是错误的。但即使这样，在当下，没有完全证明是其他原因造成气候变暖的情况下，现在的理论是可能性最大的。存疑没错，但需要决定性的证据。但视频中的证据我认为站不住。个人观点。,3
1702,390710,哈哈哈，人均博士学位，这些都是科学家经常严密实验思考提出的，你们这么说那快点去用你们的数据去推翻，我在CCTV等着你们出现,4
1703,390712,我只知道二氧化碳能使我的被窝变暖，在蒙着头的时候。,4
1704,390716,海洋污染感觉比二氧化碳严重很多( ´_ゝ｀)有部纪录片 塑料海洋 可以看看,4
1705,390720,不考虑太阳活动周期就靠两张图就在这瞎科普和耍流氓有啥区別，咋地兄弟你比国家还牛啊，联合国开会没叫你还真是一大损失,1
1706,390723,来来，给我解释一下热岛效应？,4
1707,390724,敢问up文化水平,4
1708,390725,所以到底是怎么回事?,3
1709,390726,海南的冬天一年比一年暖了。。。。今天25度。。。前几天还飙到二十八三十度左右,1
1710,390727,二氧化碳与全球变暖相关【回到2049】S02E43 温室巨擘：二氧化碳攻防战,1
1711,390740,几天前的科普电视里，最有力的证据是，古代冰心的二氧化碳很少，于是把锅甩给现代的二氧化碳。我看这完全只是 间接证据，并不是直接证明,1
1712,390741,一个和太阳有关系，二个变暖导致的温度升高会使得南北极的冰川融化速度加快，冰化水吸热反而会导致温度下降，这应该是地球的平衡。正如太阳聚变的内部调节一样。一个这个庞大生态要出现问题要很长很长的时间几千年就是一瞬间说明不了什么，就如同年轻的太阳已经存在几十亿年了,1
1713,390746,少污染，总是没错的。绿**好型发展，也不是办不到啊。,1
1714,390458,我觉得说人类的活动对地球产生深远影响纯属扯淡，这种说法太高估人类的能力了，人类最多只是暂时打破一个平衡。而平衡其实也是相对的，没有绝对的平衡。纵观地球的历史，各段冰川期，行星撞击，哪个对地球生态系统平衡的破坏不比现在强烈的多？环保，无可厚非，直接影响我们的生存质量，但是如果利用这个命题遏制我们发展，谁会同意？发达国家工业化那么早，他们原来排的碳怎么算？谁排多少配额怎么定？配额不够需要买，价格怎么定？这是发达国家玩的手段，主要目的就是遏制你发展。,2
1715,390469,很多人说化石燃料会释放多余的二氧化碳，我在此借用各位的说法，这些化石燃料是动植物尸体演变而来，那么我们回溯时间，在这些化石燃料没堆积之前，地球怎么样？多与少对于地球都没有太大影响，也没看到生物灭绝嘛。,2
1716,390474,而且除了无机物之外，其他所有物质或多或少都会排放热能，这些热能到哪去？所以人口的增加也是引起地球变暖的原因，不过由于人类增多，动物相应的减少，影响现在不算大。,1
1717,390479,本来煤炭或者汽油等燃料都以液体或固体的形式存在，人类把他们燃烧之后，他们就化为了热能散在了空气里，地球的温度也会相应升高，而燃烧会产生二氧化碳，这就是控制碳排放的原因。谁告诉你二氧化碳会引起地球变暖？谁告诉你的？,1
1718,390447,就我目前学习到的地史学知识，地质历史时期中，自节律海平面变化（冰川型海平面变化）比如奥陶纪与志留纪之交的海平面变化表明，低海平面期与大气中低二氧化碳含量期以及冰期都具有明显关系。具体可以参阅龚一鸣教授的关于耦合节律的文章。,1
1719,390448,我以前在cctv看过其实部分原因在于太阳发出的太阳风暴,1
1720,390449,关键是工业污染  重工业的废气不止含有C02 还有其他毒性气体  其他的导致的后果更严重,1
1721,390450,即使看起来不会导致全球变暖，低碳也要做下去，毕竟影响生态平衡(｀・ω・´),1
1722,390451,全球温度变化趋势好像就是从工业**开始开始温度加剧上升的吧,1
1723,390350,利益相关，就没有真相，有些人坏，多数人蠢。我看一个耳机的科普都能看到有人对着数据睁眼说瞎话，何况碳排放权这种国家利益级别的事。很多人又要选边站队了，或者被固有思想主导着。科学是一种方法论，其最重要的精神是怀疑，科学理论令人信服不在于对，而在于不错。能经受别人质疑才能更接近真相。,3
1724,390351,二氧化碳大概只能影响人类的生活质量，气温变化真的与他有没有关系不好说，毕竟以前地球经历过比现在还浓郁的二氧化碳时代，怕就怕在人类工业还是什么不知名的原因导致南北极臭氧层破洞，随便来个高能宇宙辐射，南北极一融化，引发毁灭一切的大洪水，那是真的一起玩完，没救了。,2
1725,390352,二氧化碳不是温室气体之一  怎么变主凶了,1
1726,390353,环境污染是人类发展的必然，别整天怪这怪那，自己先把环保做好再批评别人。你上b站的手机，家里的所有电器，身上穿的衣物，哪一样不是污染环境换来的？为环保你又做了多少？环保不仅仅需要政府、企业努力，更需要社会的共同努力。从自己做起从身边做起，环保是大家的责任，而不应该只是归咎于某一团体组织。,1
1727,390354,二氧化碳溶于海水，在南北极遇冷沉入海底，这个循环是地球吸收二氧化碳的主要方式。每年洋流的改变都会严重影响。地球升温是各种原因共同造成的。,1
1728,390355,别管二氧化碳了 来干了这杯重金属,3
1729,390356,环境科学专业学生表示课本上明确过多二氧化碳存储了过多的热，是导致全球变暖的主要原因之一,1
1730,390357,很多年以前——我还不知道上网——那会儿经常看书，有看到全球变暖的一篇文章。有说到过地球历史上经历过几次的温度变化，也说到了按时间推算现在正处于第五次（记得应该是第五次）温度上升期。文章中还说，虽说处于上升期，但是温度上升速度较前几次快很多。,1
1731,390358,环境真得变了秋天会越吃越胖春天会越减越肥,4
1732,390359,意义在哪呢？人类的碳排放大多是将原本植物或者动物储存起来的碳元素释放出来（煤炭，石油等）这些碳是不参与地球生态循环的，然而大自然中所产生与释放的二氧化碳最终都会有被回收或者说是保持的方式。所以说人类多排放出来的这些碳就可能会导致生态系统的紊乱,1
1733,390360,我更相信这是城市现代化带来的热岛效应，大片的水泥地,1
1734,390303,作为一个环保人士，忽然有种自己懂的东西太太……少了，真的是随大流了,1
1735,390313,第一，资源决定了人类用什么发展，如何生存和一个国家的年限。第二，地球生态遭受人类的破坏，形将瓦解，国家职能也只不过说说而已，整个人类的群体意识好比机器，无法控制，只能引导。第三，科学界没有说谎，国家更必要欺骗民众，温室气体本就有多种气体。第四，人类活动使大气成分在改变；动植物的改变也影响了大气成分；雾霾是在我们这一代出现的；南北极的冰雪真的在不可逆的逐步消失；至少在中国大陆已经没有了自然意义的湖泊，森林；第五，地球不会一下子变暖，也不会一下子变冷，至少在他变化以前，原有生态将不复存在。   要知道，我们已不是这个生态的组成部分，生命不是宇宙的常态，而是被夸大的偶然现象。,1
1736,390317,我感觉开始让我想到好像小学的课文《两个铁球同时落地》和一篇忘了题目说一条金鱼放进一个满了水的杯子里水不会溢出来的，铁球的最让我觉得像，说科学家说的不一定完全对，我们要有自己的判断，不能说科学说对就完全相信对的说法。,4
1737,390318,太阳短波辐射被地面接收，以地面长波形式反射，对流层中的CO2强烈吸收地面长波辐射，并且再以大气逆辐射的形式返还大地，这才产生了温室效应。,1
1738,390320,但是低碳总没坏处,1
1739,390322,但是化石燃料的燃烧时产生的二氧化硫二氧化氮等其他有害气体的危害是确确实实的,1
1740,390323,全球暗化怎么办？与温室效应密切相关,1
1741,390327,up主论述他观点的依据在我看来并不充分，具体的证据也没有讲出来，我只看到了主观意识的辨析。然后再说一下我对温室效应的看法，从CO2的角度我看不明白，但是我认为碳排放是将地球无数年所积攒的太阳能释放出来，从能量的角度来说碳排放导致了地球化学能的减少，其他形式的能增加，比如内能等等。所以我认为碳排放与全球变暖有关系。,1
1742,390328,Up逻辑没错，提出合理质疑。但是二氧化碳有没有锅对于我们一般人来说还真是没法证明的。,3
1743,390329,但二氧化碳的确是温室气体的一种，而且是比较好量化控制的。不签订协议中影响发展起到比较关键的因素。实际上应该是说，碳交易是一个阴谋（因为不应该有，是明摆着限制发展和收钱），而减排本身则不是阴谋。最最关键的就是，二氧化碳的确算是温室气体，而且，大气碳含量不止影响到气温，还影响植物的成分（碳多，导致提供能量的淀粉类合成比例更多，这个是有定论的，从这个数据看减排是有必要的，因为人摄入相同营养时摄入的热量会变多）等等。（另外，只展示2个数据而无法对其他变量操控的数据，都是没啥用的，所以，不要有定论啊，因为是温室气体，所以必定有关，而有关多少，则很难说）,1
1744,390330,楼下那个，你说中国碳排放是美国好几倍…你有什么意图？还有历史碳排放这个说法，提前开始排，提前排完了。这对发展中国家是不公平的，而且人口基数巨大，你觉得碳排放应该按国家为单位还是按人口为单位？中国碳排放拿去和梵蒂冈比?咋不说碳排放的划分发达国家划去了百分之四十多，剩下的发展中国家只占百分之五十多一点，但发达国家人口只占16％，不公平吧？按国家为单位不公平，按人口为单位也不肯，咋办啊?多了不要，我们人均到你美国二分之一就行，吃点亏可以不,3
